{
  "checks": [
    {
      "name": "subject-digest",
      "pass": true
    },
    {
      "name": "nonempty-utf8",
      "pass": true
    },
    {
      "name": "model-only-boundary",
      "pass": true
    },
    {
      "name": "user-control-boundary",
      "pass": true
    },
    {
      "name": "no-upstream-provider-policy",
      "pass": true
    },
    {
      "name": "structured-procedure",
      "pass": true
    }
  ],
  "contract": {
    "name": "research-os/port-evaluation-detail",
    "version": "1.0.0"
  },
  "kind": "adapted-discipline",
  "result": "pass",
  "subject_sha256": "99281397d25824c2e0a2d1e2b1c56d8c90bab4f1addf905dff01037869b03c3e",
  "tree_sha256": "43c9730fe920345c5b00d2433f70ad3482f31b3722f18713245013fa53e9626c"
}
