{
  "checks": [
    {
      "name": "subject-digest",
      "pass": true
    },
    {
      "name": "nonempty-utf8",
      "pass": true
    },
    {
      "name": "fixed-modules",
      "pass": true
    },
    {
      "name": "fixed-theorems",
      "pass": true
    },
    {
      "name": "axiom-allowlist",
      "pass": true
    }
  ],
  "contract": {
    "name": "research-os/port-evaluation-detail",
    "version": "1.0.0"
  },
  "kind": "baseline-comparator",
  "result": "pass",
  "subject_sha256": "b100ddca78898d7df24225bef99c54be286ad5251cbd0806e584b7646a3700b2",
  "tree_sha256": "366e0851941192abc2c70f5802ddc72171c8c393343431e73e21ef936d1f7349"
}
